{
  "protocol_version": "0.1.0",
  "message_id": "019f80c2-e97e-7bc2-96bc-f927e69597dc",
  "timestamp": "2026-07-20T18:30:30Z",
  "simulation_id": "b0b0f1c5-afb9-4fa7-8bbd-96dc0fdcfdee",
  "kind": "shutdown",
  "payload": {
    "reason": "operator_request"
  },
  "correlation_id": null,
  "status": "ok",
  "error": null
}
