{
  "protocol_version": "0.1.0",
  "message_id": "019f80c2-e97d-7955-a13b-82a9a372e95d",
  "timestamp": "2026-07-20T18:30:16Z",
  "simulation_id": "b0b0f1c5-afb9-4fa7-8bbd-96dc0fdcfdee",
  "kind": "command.request",
  "payload": {
    "action": "set_park_entry_fee",
    "params": { "price": 10 },
    "idempotency_key": "gov-2026-07-20-0002",
    "expiry_tick": 13000
  },
  "correlation_id": null,
  "status": null,
  "error": null
}
