{
  "protocol_version": "0.1.0",
  "message_id": "019f80c2-e97d-77f7-91f2-8589436556b3",
  "timestamp": "2026-07-20T18:30:19Z",
  "simulation_id": "b0b0f1c5-afb9-4fa7-8bbd-96dc0fdcfdee",
  "kind": "command.request",
  "payload": {
    "action": "close_ride",
    "params": { "ride_id": 1 },
    "idempotency_key": "gov-2026-07-20-0005",
    "expiry_tick": 13000
  },
  "correlation_id": null,
  "status": null,
  "error": null
}
