{
  "protocol_version": "0.1.0",
  "message_id": "019f80c2-e97d-7e95-b751-a1a3fb0debc2",
  "timestamp": "2026-07-20T18:30:17Z",
  "simulation_id": "b0b0f1c5-afb9-4fa7-8bbd-96dc0fdcfdee",
  "kind": "command.request",
  "payload": {
    "action": "hire_staff",
    "params": { "type": "mechanic" },
    "idempotency_key": "gov-2026-07-20-0003",
    "expiry_tick": 13000
  },
  "correlation_id": null,
  "status": null,
  "error": null
}
