{
  "protocol_version": "0.1.0",
  "message_id": "019f80c2-e97e-7e30-a75d-6a4b7b221eed",
  "timestamp": "2026-07-20T18:30:31Z",
  "simulation_id": "b0b0f1c5-afb9-4fa7-8bbd-96dc0fdcfdee",
  "kind": "ack",
  "payload": {},
  "correlation_id": "019f80c2-e979-7815-8997-cde5e8bc3bae",
  "status": "ok",
  "error": null
}
